{
  "$schema": "./action_registry_schema.json",
  "version": "0.1.0",
  "generated": "2026-03-23",
  "families": {
    "F1": {
      "name": "Template/Bundle",
      "generatorReadiness": "READY",
      "canonActionCount": 8,
      "registryActionCount": 8,
      "blockingIssue": null
    },
    "F2": {
      "name": "Upload/Convert",
      "generatorReadiness": "READY",
      "canonActionCount": 3,
      "registryActionCount": 3,
      "blockingIssue": null
    },
    "F3": {
      "name": "Source Panel",
      "generatorReadiness": "MOSTLY_READY",
      "canonActionCount": 19,
      "registryActionCount": 7,
      "blockingIssue": "S7-S10/S13-S14/S17 need canvas gestures; S11 duplicate of S6; S15/S16 deferred alias rows (=C3/C4); S18 needs inputRange; S19 PARTIAL"
    },
    "F4": {
      "name": "Context Menu",
      "generatorReadiness": "READY",
      "canonActionCount": 9,
      "registryActionCount": 9,
      "blockingIssue": null
    },
    "F5": {
      "name": "Source-to-Grid",
      "generatorReadiness": "NEEDS_DESIGN",
      "canonActionCount": 2,
      "registryActionCount": 0,
      "blockingIssue": "D1/D2 PROVEN via source-to-grid runner (380edee) at root + /xpedit. Cross-panel drag-coordinate abstraction needed for registry, but proof exists. Registry entries not yet populated."
    },
    "F6": {
      "name": "Grid Panel",
      "generatorReadiness": "MOSTLY_READY",
      "canonActionCount": 14,
      "registryActionCount": 5,
      "blockingIssue": "G3/G4 deferred (dual-button schema gap); G7/G8 deferred alias rows (=C6/C7); G13 needs inputRange; G1/G2/G12/G14 need canvas gestures"
    },
    "F7": {
      "name": "Whole-Sheet Editor",
      "generatorReadiness": "NEEDS_DESIGN",
      "canonActionCount": 18,
      "registryActionCount": 18,
      "blockingIssue": "W12/W13 READY (stable header buttons). 13/18 NEEDS_DESIGN (canvas/keyboard/dynamic-row gesture abstractions). W15 WIRED — visualization connected (960974f) but needs verifier proof + canvas gesture abstraction for generator. W16/W17 DEFERRED. W18 PROVEN but deferred (dual-button schema gap)."
    },
    "F8": {
      "name": "Jitter/Alignment",
      "generatorReadiness": "READY",
      "canonActionCount": 6,
      "registryActionCount": 6,
      "blockingIssue": null
    },
    "F9": {
      "name": "Lifecycle",
      "generatorReadiness": "READY",
      "canonActionCount": 3,
      "registryActionCount": 3,
      "blockingIssue": null
    },
    "F10": {
      "name": "Runtime Dock",
      "generatorReadiness": "READY",
      "canonActionCount": 7,
      "registryActionCount": 7,
      "blockingIssue": null
    },
    "F11": {
      "name": "Bug Report / UI Recorder",
      "generatorReadiness": "READY",
      "canonActionCount": 7,
      "registryActionCount": 7,
      "blockingIssue": null
    },
    "F12": {
      "name": "XP Preview",
      "generatorReadiness": "READY",
      "canonActionCount": 4,
      "registryActionCount": 4,
      "blockingIssue": null
    }
  },
  "actions": {
    "T1": {
      "id": "T1",
      "name": "Apply template",
      "family": "F1",
      "status": "PROVEN",
      "m2Scope": "M1-closed",
      "generatorReadiness": "READY",
      "acceptanceEligible": true,
      "selectorKey": "templateApplyBtn",
      "gestureType": "click",
      "preconditions": {},
      "postconditions": {
        "templateSetKey": {
          "op": "changed",
          "value": null
        }
      },
      "blockers": [],
      "paramBindings": [
        {
          "selectorKey": "templateSelect",
          "gestureType": "selectOption",
          "paramKey": "templateValue"
        }
      ]
    },
    "T2": {
      "id": "T2",
      "name": "Switch action tab",
      "family": "F1",
      "status": "PROVEN",
      "m2Scope": "M1-closed",
      "generatorReadiness": "READY",
      "acceptanceEligible": true,
      "selectorKey": "bundleActionTabs",
      "gestureType": "click",
      "preconditions": {
        "bundleId": {
          "op": "truthy",
          "value": null
        }
      },
      "postconditions": {
        "activeActionKey": {
          "op": "changed",
          "value": null
        }
      },
      "blockers": [],
      "paramBindings": []
    },
    "T3": {
      "id": "T3",
      "name": "Save session",
      "family": "F1",
      "status": "PROVEN",
      "m2Scope": "M1-closed",
      "generatorReadiness": "READY",
      "acceptanceEligible": true,
      "selectorKey": "btnSave",
      "gestureType": "click",
      "preconditions": {
        "sessionId": {
          "op": "truthy",
          "value": null
        }
      },
      "postconditions": {
        "sessionDirty": false
      },
      "blockers": [],
      "paramBindings": []
    },
    "T4": {
      "id": "T4",
      "name": "Export XP",
      "family": "F1",
      "status": "PROVEN",
      "m2Scope": "M1-closed",
      "generatorReadiness": "READY",
      "acceptanceEligible": true,
      "selectorKey": "btnExport",
      "gestureType": "click",
      "preconditions": {
        "sessionId": {
          "op": "truthy",
          "value": null
        }
      },
      "postconditions": {},
      "blockers": [],
      "paramBindings": []
    },
    "T5": {
      "id": "T5",
      "name": "New XP",
      "family": "F1",
      "status": "WIRED",
      "m2Scope": "M2-D",
      "generatorReadiness": "READY",
      "acceptanceEligible": true,
      "selectorKey": "btnNewXp",
      "gestureType": "click",
      "preconditions": {},
      "postconditions": {
        "sessionId": {
          "op": "changed",
          "value": null
        }
      },
      "blockers": [],
      "paramBindings": []
    },
    "T6": {
      "id": "T6",
      "name": "Import XP",
      "family": "F1",
      "status": "PROVEN",
      "m2Scope": "M1-closed",
      "generatorReadiness": "READY",
      "acceptanceEligible": true,
      "selectorKey": "xpImportBtn",
      "gestureType": "click",
      "preconditions": {},
      "postconditions": {
        "sessionId": {
          "op": "truthy",
          "value": null
        }
      },
      "blockers": [],
      "paramBindings": [
        {
          "selectorKey": "xpImportFile",
          "gestureType": "setInputFiles",
          "paramKey": "filePath"
        }
      ]
    },
    "T7": {
      "id": "T7",
      "name": "Test skin (Skin Dock)",
      "family": "F1",
      "status": "PROVEN",
      "m2Scope": "M1-closed",
      "generatorReadiness": "READY",
      "acceptanceEligible": true,
      "selectorKey": "webbuildQuickTestBtn",
      "gestureType": "click",
      "preconditions": {
        "sessionId": {
          "op": "truthy",
          "value": null
        }
      },
      "postconditions": {},
      "blockers": [],
      "paramBindings": []
    },
    "T8": {
      "id": "T8",
      "name": "Delete action",
      "family": "F1",
      "status": "PLANNED",
      "m2Scope": "M2-D",
      "generatorReadiness": "DEFERRED",
      "acceptanceEligible": false,
      "selectorKey": null,
      "gestureType": "click",
      "preconditions": {
        "bundleId": {
          "op": "truthy",
          "value": null
        }
      },
      "postconditions": {},
      "blockers": [
        "No handler found — PLANNED status, no DOM element exists yet"
      ],
      "paramBindings": []
    },
    "U1": {
      "id": "U1",
      "name": "Upload PNG",
      "family": "F2",
      "status": "PROVEN",
      "m2Scope": "M2-B",
      "generatorReadiness": "READY",
      "acceptanceEligible": true,
      "selectorKey": "wbUpload",
      "gestureType": "click",
      "preconditions": {},
      "postconditions": {
        "sourceImageLoaded": true
      },
      "blockers": [],
      "paramBindings": [
        {
          "selectorKey": "wbFile",
          "gestureType": "setInputFiles",
          "paramKey": "filePath"
        }
      ]
    },
    "U2": {
      "id": "U2",
      "name": "Analyze",
      "family": "F2",
      "status": "WIRED",
      "m2Scope": "M2-F",
      "generatorReadiness": "READY",
      "acceptanceEligible": true,
      "selectorKey": "wbAnalyze",
      "gestureType": "click",
      "preconditions": {
        "sourceImageLoaded": true
      },
      "postconditions": {},
      "blockers": [],
      "paramBindings": []
    },
    "U3": {
      "id": "U3",
      "name": "Convert to XP (Run pipeline)",
      "family": "F2",
      "status": "PROVEN",
      "m2Scope": "M2-A",
      "generatorReadiness": "READY",
      "acceptanceEligible": true,
      "selectorKey": "wbRun",
      "gestureType": "click",
      "preconditions": {
        "sourceImageLoaded": true
      },
      "postconditions": {
        "sessionId": {
          "op": "truthy",
          "value": null
        }
      },
      "blockers": [],
      "paramBindings": []
    },
    "C1": {
      "id": "C1",
      "name": "Add as 1 sprite",
      "family": "F4",
      "status": "PROVEN",
      "m2Scope": "M2-B",
      "generatorReadiness": "READY",
      "acceptanceEligible": true,
      "selectorKey": "srcCtxAddSprite",
      "gestureType": "click",
      "preconditions": {
        "sourceContextMenu": "visible",
        "drawCurrent": {
          "op": "truthy",
          "value": null
        }
      },
      "postconditions": {
        "extractedBoxes": {
          "op": "changed",
          "value": null
        }
      },
      "blockers": [],
      "paramBindings": []
    },
    "C2": {
      "id": "C2",
      "name": "Add to selected row sequence",
      "family": "F4",
      "status": "WIRED",
      "m2Scope": "M2-B",
      "generatorReadiness": "READY",
      "acceptanceEligible": true,
      "selectorKey": "srcCtxAddToRow",
      "gestureType": "click",
      "preconditions": {
        "sourceContextMenu": "visible",
        "selectedRow": {
          "op": "gte",
          "value": 0
        }
      },
      "postconditions": {},
      "blockers": [],
      "paramBindings": []
    },
    "C3": {
      "id": "C3",